id,claim,status,evidence,artifacts,metrics,sets_scope,limitations,permitted_wording,prohibited_wording
C1,Distributed state memory acts inside feedback and changes augmented-system dynamics.,SUPPORTED,Gate 1 tangent recurrence and failed separable ansatz,results/eeg/theory_vs_sim_check.csv,four local response metrics,local four-qubit configuration,Local linear mechanism; not hardware realization.,Distributed state memory acts inside feedback and changes the augmented-system dynamics.,The kernel is only an external W(z) filter applied to K=0.
C2,The tangent recurrence locally reproduces the simulator.,SUPPORTED_LOCAL,All frozen tangent tolerances pass,results/eeg/theory_vs_sim_check.csv,impulse/step/FFT/memory errors,epsilon=1e-4,Local small-signal statement only.,The tangent recurrence reproduces the simulator locally.,The linear theory explains all EEG forecasting performance.
C3,Theory predicts between-process differences and partially recovers within-process ordering.,SUPPORTED_WITH_LIMITS,Frozen Gate 2 plus post-gate centered analysis,results/synth/theory_predictions_vs_measured.csv;results/synth/gate2_postgate_sensitivity.csv,"aggregate/within correlations, 6/10 best, pairwise ordering",10 frozen scenarios,Within-scenario evidence is moderate and has explicit failures.,Theory predicts process differences and partially recovers model ordering within processes.,Theory universally predicts the best kernel.
C4,Distributed memory changes horizon dependence in F and Z.,SUPPORTED_F_Z,Frozen model×horizon interaction,results/eeg/gate_interactions.csv,paired bootstrap CI and Holm p,F and Z segments,Single Bonn database; segment-level; h=64 lacks absolute skill.,Distributed memory alters error dependence on horizon in F and Z.,There is quantum advantage or universal forecasting superiority.
C5,S is null in the primary causal test.,NULL,Kernel-vs-K0 CI crosses zero,results/eeg/gate_interactions.csv,interaction and Holm p,S segments,Null is a valid result and remains visible.,S yielded a null result in the primary causal test.,The effect was demonstrated in all three sets.
C6,Distributed-memory class differs from discrete delay in some comparisons.,PARTIAL,EEG interactions and tied distributed shapes,results/eeg/gate_nrmse_curves.csv;results/eeg/gate_interactions.csv,degradation curves,F/Z/S segments,"Exponential, triangular and uniform shapes overlap.",Results favor distributed memory over discrete delay in part of the comparisons.,The exponential form is universally superior to triangular and uniform forms.
C7,Finite-shot sensitivity is heterogeneous; principal F/Z signs persist.,MIXED_SHOT_SENSITIVITY,Gate 3 finite-shot analysis,results/eeg/shot_sensitivity_classification.csv;results/eeg/shot_sensitivity_contrasts.csv,"median, P90, strata and contrast signs",F/Z principal; S reported null,Large tail; readout sampling only; not hardware.,Shot robustness is heterogeneous and principal F/Z signs are qualitatively preserved.,The method is globally shot-robust or hardware-ready.
